{
  "action": "records delete",
  "body": null,
  "endpoint": "/zones/zone123/dns_records/record123",
  "live_state_hash": "8d8cf6502cfbb8f5255a987d5245eb09fc6ed44d9ecb8af33f4135f2d0780c23",
  "method": "DELETE",
  "plan_hash": "aaaaaaaaaaaaaaaaaaaaaaaaaaaaaaaaaaaaaaaaaaaaaaaaaaaaaaaaaaaaaaaa",
  "snapshot_required": false,
  "snapshot_waived": false
}
